{
  "schema_version": "intake.raw-record.v1",
  "record_kind": "listener_session",
  "record_id": "06000000-0000-4000-8000-000000000001",
  "logical_id": "5a5e5100-0000-4000-8000-000000000002",
  "revision": 1,
  "captured_at": "2026-09-24T08:00:00+07:00",
  "recorded_at": "2026-09-24T08:00:00+07:00",
  "source": {
    "provider": "zalo_personal",
    "account_id": "aaaaaaaa-0000-4000-8000-000000000001"
  },
  "listener": {
    "session_id": "51ee5100-0000-4000-8000-000000000099",
    "state": "connected",
    "observed_at": "2026-09-24T08:00:00+07:00",
    "last_heartbeat_at": "2026-09-24T08:00:00+07:00"
  }
}
