{
  "schema_version": "intake.raw-record.v1",
  "record_kind": "ocr_page",
  "record_id": "05000000-0000-4000-8000-000000000009",
  "logical_id": "05000000-0000-4000-8000-000000000002",
  "revision": 2,
  "captured_at": "2026-09-24T08:00:00+07:00",
  "recorded_at": "2026-09-24T08:05:00+07:00",
  "source": {
    "provider": "zalo_personal",
    "account_id": "aaaaaaaa-0000-4000-8000-000000000001",
    "conversation_id": "conv-7001",
    "conversation_type": "group",
    "provider_message_id": "gmsg-900001",
    "client_message_id": "cmsg-900001",
    "sender_id": "uid-1001",
    "sender_display_name": "Nguoi Gui Demo",
    "source_sent_at": "2026-09-24T07:59:58+07:00",
    "attachment_id": "05000000-0000-4000-8000-0000000000a1",
    "attachment_index": 0,
    "page_index": 1
  },
  "supersedes": {
    "record_id": "05000000-0000-4000-8000-000000000001",
    "revision": 1
  },
  "image_sha256": "2c1ce21956e0bc95b4faa0f368ffb6c9b819e9b725f07d3bdc055feeb6d8efd8",
  "image_expires_at": "2026-10-01T08:00:00+07:00",
  "image_state": "captured",
  "ocr": {
    "status": "succeeded",
    "attempts": [
      {
        "ocr_pass_id": "pass-orig",
        "provider": "qwen",
        "model": "qwen-vl-ocr-2025-11-20",
        "task": "text_recognition",
        "image_operation": "original",
        "region": {
          "kind": "full_image"
        },
        "transform_chain": [
          {
            "op": "exif_transpose"
          },
          {
            "op": "resize",
            "params": {
              "max_side": 1800,
              "quality": 82
            }
          }
        ],
        "geometry_status": "not_applicable",
        "status": "succeeded",
        "started_at": "2026-09-24T08:01:00+07:00",
        "config_version": "ocr-config-v1",
        "submitted_frame": {
          "frame_id": "05000000-0000-4000-8000-0000000000f1",
          "width": 1800,
          "height": 1200
        },
        "completed_at": "2026-09-24T08:02:00+07:00"
      },
      {
        "ocr_pass_id": "pass-crop",
        "provider": "qwen",
        "model": "qwen-vl-ocr-2025-11-20",
        "task": "text_recognition",
        "image_operation": "crop_bottom",
        "region": {
          "kind": "bottom_fraction",
          "fraction": 0.42
        },
        "transform_chain": [
          {
            "op": "exif_transpose"
          },
          {
            "op": "resize",
            "params": {
              "max_side": 2400
            }
          },
          {
            "op": "crop",
            "params": {
              "top_fraction": 0.58
            }
          }
        ],
        "geometry_status": "not_applicable",
        "status": "succeeded",
        "started_at": "2026-09-24T08:01:00+07:00",
        "config_version": "ocr-config-v1",
        "submitted_frame": {
          "frame_id": "05000000-0000-4000-8000-0000000000f1",
          "width": 1800,
          "height": 1200
        },
        "completed_at": "2026-09-24T08:02:00+07:00",
        "request_id": "05000000-0000-4000-8000-0000000000c1"
      }
    ],
    "selected_pass_ids": [
      "pass-orig"
    ],
    "text_lines": [
      {
        "line_id": "05000000-0000-4000-8000-0000000000b1",
        "text": "Ngay cap: 01/02/2020",
        "captured_at": "2026-09-24T08:00:00+07:00",
        "page_index": 1,
        "ocr_pass_id": "pass-orig"
      }
    ]
  }
}
