{
  "schema_version": "intake.raw-record.v1",
  "record_kind": "ocr_page",
  "record_id": "11000000-0000-4000-8000-000000000001",
  "logical_id": "11000000-0000-4000-8000-000000000002",
  "revision": 1,
  "captured_at": "2026-09-24T08:00:00+07:00",
  "recorded_at": "2026-09-24T08:05:00+07:00",
  "source": {
    "provider": "zalo_personal",
    "account_id": "aaaaaaaa-0000-4000-8000-000000000001",
    "conversation_id": "conv-7001",
    "conversation_type": "group",
    "provider_message_id": "gmsg-900001",
    "client_message_id": "cmsg-900001",
    "sender_id": "uid-1001",
    "sender_display_name": "Nguoi Gui Demo",
    "source_sent_at": "2026-09-24T07:59:58+07:00",
    "attachment_id": "11000000-0000-4000-8000-0000000000a1",
    "attachment_index": 0,
    "page_index": 1
  },
  "image_sha256": "b076537568a78d81dd1b593837d17e6d4381be6f476385261687007e3209f5c9",
  "image_expires_at": "2026-10-01T08:00:00+07:00",
  "image_state": "captured",
  "ocr": {
    "status": "succeeded",
    "attempts": [
      {
        "ocr_pass_id": "pass-orig",
        "provider": "qwen",
        "model": "qwen-vl-ocr-2025-11-20",
        "task": "text_recognition",
        "image_operation": "original",
        "region": {
          "kind": "full_image"
        },
        "transform_chain": [
          {
            "op": "exif_transpose"
          },
          {
            "op": "resize",
            "params": {
              "max_side": 1800,
              "quality": 82
            }
          }
        ],
        "geometry_status": "not_applicable",
        "status": "succeeded",
        "started_at": "2026-09-24T08:01:00+07:00",
        "config_version": "ocr-config-v1",
        "submitted_frame": {
          "frame_id": "11000000-0000-4000-8000-0000000000f1",
          "width": 1800,
          "height": 1200
        },
        "completed_at": "2026-09-24T08:02:00+07:00"
      },
      {
        "ocr_pass_id": "pass-full",
        "provider": "qwen",
        "model": "qwen-vl-ocr-2025-11-20",
        "task": "text_recognition",
        "image_operation": "full_res",
        "region": {
          "kind": "full_image"
        },
        "transform_chain": [
          {
            "op": "exif_transpose"
          },
          {
            "op": "resize",
            "params": {
              "max_side": 2400,
              "quality": 90
            }
          }
        ],
        "geometry_status": "not_applicable",
        "status": "succeeded",
        "started_at": "2026-09-24T08:01:00+07:00",
        "config_version": "ocr-config-v1",
        "submitted_frame": {
          "frame_id": "11000000-0000-4000-8000-0000000000f1",
          "width": 1800,
          "height": 1200
        },
        "completed_at": "2026-09-24T08:02:00+07:00"
      }
    ],
    "selected_pass_ids": [
      "pass-orig",
      "pass-full"
    ],
    "text_lines": [
      {
        "line_id": "11000000-0000-4000-8000-0000000000b1",
        "text": "CONG HOA XA HOI CHU NGHIA VIET NAM",
        "captured_at": "2026-09-24T08:00:00+07:00",
        "page_index": 1,
        "ocr_pass_id": "pass-orig"
      },
      {
        "line_id": "11000000-0000-4000-8000-0000000000b2",
        "text": "So vao so: AB-123456",
        "captured_at": "2026-09-24T08:00:00+07:00",
        "page_index": 1,
        "ocr_pass_id": "pass-full"
      }
    ]
  }
}
