{
  "schema_version": "intake.raw-record.v1",
  "record_kind": "message_text",
  "record_id": "03000000-0000-4000-8000-000000000001",
  "logical_id": "03000000-0000-4000-8000-000000000002",
  "revision": 1,
  "captured_at": "2026-09-24T08:00:00+07:00",
  "recorded_at": "2026-09-24T08:05:00+07:00",
  "source": {
    "provider": "zalo_personal",
    "account_id": "aaaaaaaa-0000-4000-8000-000000000001",
    "conversation_id": "conv-7001",
    "conversation_type": "group",
    "provider_message_id": "gmsg-900001",
    "client_message_id": "cmsg-900001",
    "sender_id": "uid-1001",
    "sender_display_name": "Nguoi Gui Demo",
    "source_sent_at": "2026-09-24T07:59:58+07:00"
  },
  "message": {
    "text": "Da nhan duoc giay to anh gui, cam on anh."
  }
}
